{
  "schemaVersion": "1.0",
  "note": "Реестр нормативных источников. Правила в requirements/*.json ссылаются сюда по sourceId. Файл — не источник права; поле file указывает на экземпляр документа, по которому выполнена транскрипция, sha256 фиксирует именно этот экземпляр.",
  "sources": {
    "msk-284-pp": {
      "authority": "Постановление Правительства Москвы от 30.04.2013 № 284-ПП",
      "title": "Об оптимизации порядка утверждения архитектурно-градостроительных решений объектов капитального строительства в городе Москве",
      "adoptedOn": "2013-04-30",
      "status": "active",
      "contains": [
        "Положение об утверждении архитектурно-градостроительных решений объектов капитального строительства в городе Москве",
        "Административный регламент предоставления государственной услуги"
      ],
      "transcribed": "partial",
      "url": "https://www.mos.ru/pgu2/landing/target/7700000000210548433/"
    },
    "msk-admin-reglament-agr": {
      "authority": "Административный регламент предоставления государственной услуги «Оформление свидетельства об утверждении архитектурно-градостроительного решения объекта капитального строительства»",
      "partOf": "msk-284-pp",
      "status": "active",
      "transcribed": "partial",
      "transcribedInto": [
        "agr-request-package"
      ],
      "note": "Приложение к Регламенту (состав материалов АГР) и приложение 2 (состав сведений формы) выделены в отдельные источники с проверяемыми файлами."
    },
    "msk-3d-2026-08-18": {
      "authority": "Распоряжение Департамента информационных технологий города Москвы и Департамента градостроительной политики города Москвы от 18.08.2026 № ДИТ-Р-56/26/04-16-473/26",
      "title": "Об утверждении технических требований к трёхмерным моделям объектов, размещаемым в электронной форме в информационных системах города Москвы",
      "adoptedOn": "2026-08-18",
      "effectiveFrom": "2026-08-18",
      "status": "active",
      "supersedes": "msk-3d-2026-01-19",
      "file": "References/Requirements/Новые_требования_к_НПМ+ВПМ_18_августа_2026_года.pdf",
      "sha256": "080e3454287f0c6a5f1edda5537cad9a9d8370089ad5ed8c48822da6a600e9e6",
      "pages": 64,
      "textLayer": false,
      "appendices": {
        "1": {
          "pages": "3-23",
          "subject": "Требования к параметрам низкополигональных трёхмерных моделей"
        },
        "2": {
          "pages": "24-64",
          "subject": "Требования к параметрам высокополигональных трёхмерных моделей"
        }
      },
      "transcribed": "full",
      "transcribedInto": [
        "moscow-npm-2026-08-18",
        "moscow-vpm-2026-08-18"
      ]
    },
    "msk-3d-2026-01-19": {
      "authority": "Предыдущая редакция требований к НПМ и ВПМ",
      "effectiveFrom": "2026-01-19",
      "status": "superseded",
      "supersededBy": "msk-3d-2026-08-18",
      "file": "References/Requirements/Изменения_в_требованиях_к_НПМ_и_ВПМ.pptx",
      "transcribed": "none",
      "note": "Хранится как дельта-презентация, не как полный текст. Используется для сверки, не для валидации."
    },
    "msk-ifc-agr": {
      "authority": "Распоряжение Департамента градостроительной политики города Москвы и Департамента информационных технологий города Москвы от 16.01.2026 № ДГП-Р-1/26/64-16-6/26",
      "status": "active",
      "transcribed": "full",
      "priority": "high",
      "note": "Опубликовано на портале «СтроимПросто» (stroimprosto.mos.ru). Реквизиты совпадают с карточкой в offDocs на странице госуслуги. Вводит понятие ЦИМ АГР. Регулирует документы 4, 5 и 7 комплекта. Сканы без текстового слоя: транскрипция велась по изображениям страниц. Файл весит 17 МБ и в репозитории не хранится — дозагружается tools/fetch_source.py со сверкой sha256.",
      "title": "Требования к материалам в формате IFC, представляемым в целях согласования архитектурно-градостроительных решений объектов капитального строительства",
      "adoptedOn": "2026-01-16",
      "effectiveFrom": "2026-01-16",
      "url": "https://stroimprosto.mos.ru/storage/app/media/KnowledgeBase/CIM_AGR_full.pdf",
      "sha256": "6e73fed38a7f06de7dc0c0ff79bc806faa02cb32b04cc0a6696a5c0815d5c012",
      "pages": 65,
      "textLayer": false,
      "transcribedInto": [
        "moscow-ifc-agr-2026-01-16"
      ],
      "appendices": {
        "разделы 4-7": {
          "pages": "6-24",
          "subject": "Общие требования, дисциплинарные ЦИМ, аннотации, экспорт, ТЭП — оцифровано"
        },
        "приложение 1": {
          "pages": "25-27",
          "subject": "Атрибуты ЦИМ ПС и БиО — не оцифровано"
        },
        "приложение 2": {
          "pages": "27-48",
          "subject": "Словарь атрибутов ЦИМ АР по классам IFC — оцифровано, 15 классов"
        },
        "приложение 3": {
          "pages": "48",
          "subject": "Типы данных атрибутов — оцифровано"
        },
        "приложение 4": {
          "pages": "49",
          "subject": "Матрица коллизий с допусками — не оцифровано"
        },
        "приложение 5": {
          "pages": "50-65",
          "subject": "XML-схема ТЭП — оцифровано, 47 элементов"
        }
      },
      "file": "sources/files/CIM_AGR_full.pdf"
    },
    "mo-npm-2025-12": {
      "authority": "Требования к низкополигональным моделям для Московской области",
      "effectiveFrom": "2025-12-01",
      "status": "active",
      "file": "References/Requirements/Требования_НПМ_для_московской_области.pdf",
      "sha256": "c66548beda26e20ffb5d8b029d392e204fecabde5bb6f1d939312670d6a711fa",
      "pages": "3-17",
      "transcribed": "full",
      "transcribedInto": [
        "moscow-oblast-npm-2025-12"
      ]
    },
    "msk-advert-2025-07": {
      "authority": "Требования к моделям рекламных конструкций",
      "effectiveFrom": "2025-07-01",
      "status": "active",
      "file": "References/Requirements/Рекламные_конструкции_нужно_проверять.pdf",
      "sha256": "f7c311403d00cbced3908438c72021a88887d43d9af174eecf8a844f76a50d43",
      "pages": "1-3",
      "transcribed": "full",
      "transcribedInto": [
        "advertising-structures-2025-07"
      ]
    },
    "msk-546-pp": {
      "authority": "Постановление Правительства Москвы от 15.11.2011 № 546-ПП",
      "title": "О предоставлении государственных и муниципальных услуг в городе Москве",
      "status": "active",
      "transcribed": "none",
      "priority": "low",
      "note": "Единые требования. Процедурные, к содержанию комплекта почти не относятся."
    },
    "msk-law-13-47": {
      "authority": "Закон города Москвы от 05.07.1995 № 13-47 «О территориальном делении города Москвы»",
      "status": "active",
      "transcribed": "none",
      "kind": "reference_data",
      "note": "Справочник территориального деления. Нужен как данные для проверки соответствия местоположения ЗУ, не как набор правил."
    },
    "msk-law-28": {
      "authority": "Закон города Москвы от 25.06.2008 № 28 «Градостроительный кодекс города Москвы»",
      "status": "active",
      "transcribed": "none"
    },
    "fz-210": {
      "authority": "Федеральный закон от 27.07.2010 № 210-ФЗ «Об организации предоставления государственных и муниципальных услуг»",
      "status": "active",
      "transcribed": "none"
    },
    "msk-digital-masterplan": {
      "authority": "Алгоритмы цифрового мастер-планирования территории города Москвы",
      "status": "not_yet_adopted",
      "transcribed": "none",
      "note": "Основание для отказа по несоответствию результатам цифрового мастер-планирования применяется только после утверждения алгоритмов в установленном порядке. До этого связанные правила несут status pending_activation."
    },
    "msk-prilozhenie-2-sostav-svedeniy": {
      "authority": "Приложение 2 к Административному регламенту предоставления государственной услуги «Оформление свидетельства об утверждении архитектурно-градостроительного решения объекта капитального строительства» в городе Москве",
      "partOf": "msk-admin-reglament-agr",
      "status": "active",
      "transcribed": "full",
      "priority": "high",
      "title": "Состав сведений интерактивной формы запроса с использованием ГИС «Портал государственных и муниципальных услуг (функций) города Москвы»",
      "amendedBy": [
        "постановление Правительства Москвы от 11.06.2024 № 1271-ПП",
        "постановление Правительства Москвы от 23.07.2024 № 1672-ПП"
      ],
      "url": "https://www.mos.ru/pgu2/landing/api/doc/6480a56e-b433-44af-87c1-40fed998e051?is_ergu=1",
      "file": "sources/files/prilozhenie-2-sostav-svedeniy.pdf",
      "sha256": "beec66f336546e631b7e1913f649c7bd6a7574ff9a2a147f231a5aabf050f715",
      "pages": 1,
      "textLayer": true,
      "note": "Вложение к пункту 1 перечня документов на странице госуслуги (sample.extId). Эндпоинт недокументированный: без ?is_ergu=1 отвечает 500. Файл сохранён в репозитории, поэтому провенанс не зависит от доступности эндпоинта. Перечисляет 11 разделов интерактивной формы запроса. Закрывает документ 1 комплекта — единственный, у которого нет файла, но есть сведения. Оцифровано в dictionaries/request-form-sections.v1.json."
    },
    "msk-prilozhenie-1-sostav-materialov": {
      "authority": "Приложение 1 к Административному регламенту предоставления государственной услуги «Оформление свидетельства об утверждении архитектурно-градостроительного решения объекта капитального строительства» в городе Москве",
      "partOf": "msk-admin-reglament-agr",
      "status": "active",
      "transcribed": "full",
      "priority": "high",
      "title": "Состав материалов архитектурно-градостроительного решения объекта капитального строительства. Требования к представляемым материалам",
      "url": "https://www.mos.ru/pgu2/landing/api/doc/16b2015b-fe0f-4e11-84c5-93ac22308270?is_ergu=1",
      "file": "sources/files/prilozhenie-sostav-materialov-agr.pdf",
      "sha256": "a122ad308bcaf4e7b9fb18b23c5cacf2dac995f776fde3f5f0b84b7a1eb479c2",
      "pages": 7,
      "textLayer": true,